"STAID","siteName","lat","lon","todayDis","meanDis","percent10","percent25","percent50","percent75","percent90"
"09423350","CARUTHERS C NR IVANPAH CA",35.24498915,-115.2988759,0,0,0,0,0,0,0
"10255800","COYOTE C NR BORREGO SPRINGS CA",33.3736453,-116.4275137,NA,NA,NA,NA,NA,NA,NA
"10255810","BORREGO PALM C NR BORREGO SPRINGS CA",33.27916667,-116.4305556,NA,NA,NA,NA,NA,NA,NA
"10255850","VALLECITO C NR JULIAN CA",32.9861588,-116.4202931,NA,NA,NA,NA,NA,NA,NA
"10257600","MISSION C NR DESERT HOT SPRINGS CA",34.01112284,-116.6280689,0,1.84,0,0,0.6,1.6,4.36
"10258000","TAHQUITZ C NR PALM SPRINGS CA",33.80501929,-116.5591816,NA,NA,NA,NA,NA,NA,NA
"10258500","PALM CYN C NR PALM SPRINGS CA",33.74502178,-116.5355709,0,0.451111111111111,0,0,0,0.02,0.995
"10259000","ANDREAS C NR PALM SPRINGS CA",33.7600211,-116.5500155,0.51,1.77416666666667,0.45,0.7375,1.1,2.125,3.8
"10259200","DEEP C NR PALM DESERT CA",33.63113647,-116.3922342,0,0.2325,0,0,0.005,0.0825,0.28
"10263500","BIG ROCK C NR VALYERMO CA",34.42083115,-117.8395072,NA,NA,NA,NA,NA,NA,NA
"10264000","LITTLE ROCK C AB LTTLE ROCK RES NR LITTLEROCK CA",34.46388375,-118.0189578,NA,NA,NA,NA,NA,NA,NA
"10264600","OAK C NR MOJAVE CA",35.04996928,-118.3578592,NA,NA,NA,NA,NA,NA,NA
"10264750","PINE TREE C NR MOJAVE CA",35.23051856,-118.0861845,NA,NA,NA,NA,NA,NA,NA
"10281800","INDEPENDENCE C BL PINYON C NR INDEPENDENCE CA",36.7785438,-118.2645412,NA,NA,NA,NA,NA,NA,NA
"10291500","BUCKEYE CK NR BRIDGEPORT, CA",38.23880787,-119.3259923,NA,NA,NA,NA,NA,NA,NA
"10295500","L WALKER RV NR BRIDGEPORT, CA",38.3607482,-119.4448868,NA,NA,NA,NA,NA,NA,NA
"10308200","E FK CARSON RV BLW MARKLEEVILLE CK NR MARKLEEVILLE",38.7146274,-119.7648985,99,787,113.5,167,450,1190,1665
"10308783","LEVIATHAN C AB MINE NR MARKLEEVILLE CA",38.7012952,-119.6565614,NA,NA,NA,NA,NA,NA,NA
"103087891","ASPEN C ABV LEVIATHAN MINE NR MARKLEEVILLE CA",38.7086111,-119.648611,NA,NA,NA,NA,NA,NA,NA
"10336580","UPPER TRUCKEE RV AT S UPPER TRUCKEE RD NR MEYERS",38.79629598,-120.0190718,NA,NA,NA,NA,NA,NA,NA
"10336600","UP TRUCKEE R NR MEYERS CA",38.8429629,-120.0246274,NA,NA,NA,NA,NA,NA,NA
"10336645","GENERAL C NR MEEKS BAY CA",39.05185197,-120.1185209,1.2,23.4994285714286,1.2,2,4,20,76.0000000000001
"10336660","BLACKWOOD C NR TAHOE CITY CA",39.10740708,-120.1621352,4.5,78.2083333333333,6,13.75,35.5,120.5,178
"10336674","WARD C BL CONFLUENCE NR TAHOE CITY CA",39.1407401,-120.2121377,NA,NA,NA,NA,NA,NA,NA
"10336676","WARD C AT HWY 89 NR TAHOE PINES CA",39.1321292,-120.1576913,1.4,57.6638888888889,3.5,9.325,25,85.25,147.5
"10336770","TROUT CK AT USFS RD 12N01 NR MEYERS, CA",38.8632405,-119.9582367,NA,NA,NA,NA,NA,NA,NA
"10343500","SAGEHEN C NR TRUCKEE CA",39.43157246,-120.2379793,1.3,16.7583333333333,1.8,2.9,5.85,17.5,44
"10359300","PINE C NR SUSANVILLE CA",40.6648935,-120.7913464,NA,NA,NA,NA,NA,NA,NA
"10360900","BIDWELL C BL MILL C NR FORT BIDWELL CA",41.8823902,-120.1749508,NA,NA,NA,NA,NA,NA,NA
"11015000","SWEETWATER R NR DESCANSO CA",32.8347737,-116.6230747,0,2.52361111111111,0,0,0.285,1.525,9.3
"11031500","AGUA CALIENTE C NR WARNER SPRINGS CA",33.2886483,-116.6539084,NA,NA,NA,NA,NA,NA,NA
"11033000","WF SAN LUIS REY R NR WARNER SPRINGS CA",33.2967036,-116.759744,NA,NA,NA,NA,NA,NA,NA
"11046300","SAN MATEO C NR SAN CLEMENTE CA",33.47085987,-117.4730986,NA,NA,NA,NA,NA,NA,NA
"11058000","SAND CANYON C NR HIGHLAND CA",34.1547222,-117.2266667,NA,NA,NA,NA,NA,NA,NA
"11058600","WATERMAN CANYON CREEK NR ARROWHEAD SPRINGS CA",34.1858333,-117.2722222,NA,NA,NA,NA,NA,NA,NA
"11073001","SAN ANTONIO C NR CLAREMONT + CN CA",34.21611738,-117.6686665,NA,NA,NA,NA,NA,NA,NA
"11073470","CUCAMONGA C NR UPLAND CA",34.1794521,-117.628943,NA,NA,NA,NA,NA,NA,NA
"11080500","EF SAN GABRIEL R NR CAMP BONITA CA",34.23583798,-117.8058928,NA,NA,NA,NA,NA,NA,NA
"11084500","FISH C NR DUARTE CA",34.1658396,-117.92423,NA,NA,NA,NA,NA,NA,NA
"11086500","LITTLE DALTON C NR GLENDORA CA",34.1675067,-117.8383937,NA,NA,NA,NA,NA,NA,NA
"11094000","BIG TUJUNGA C BL MILL C NR COLBY RANCH CA",34.30916717,-118.1453499,NA,NA,NA,NA,NA,NA,NA
"11096500","LITTLE TUJUNGA C NR SAN FERNANDO CA",34.2744464,-118.3725805,NA,NA,NA,NA,NA,NA,NA
"11098000","ARROYO SECO NR PASADENA CA",34.22222629,-118.1775727,0.32,2.95555555555556,0.31,0.6775,1.05,3.325,7.1
"11100000","SANTA ANITA C NR SIERRA MADRE CA",34.1916716,-118.0172888,NA,NA,NA,NA,NA,NA,NA
"11111500","SESPE CREEK NEAR WHEELER SPRINGS CA",34.5777657,-119.2578902,0.16,2.41548387096774,0.16,0.405,1.2,3.1,6.5
"11114495","MATILIJA C NR RES NR MATILIJA HOT SPRINGS CA",34.5027693,-119.3573393,NA,NA,NA,NA,NA,NA,NA
"11114500","MATILIJA C AB RES NR MATILIJA HOT SPRINGS CA",34.49471397,-119.330949,NA,NA,NA,NA,NA,NA,NA
"11116000","NF MATILIJA C A MATILIJA HOT SPRINGS CA",34.49249174,-119.3065034,NA,NA,NA,NA,NA,NA,NA
"11117600","COYOTE CREEK NEAR OAK VIEW CA",34.41666158,-119.3706722,NA,NA,NA,NA,NA,NA,NA
"11120500","SAN JOSE C NR GOLETA CA",34.45916286,-119.8090283,0.05,0.405142857142857,0.038,0.065,0.15,0.525,0.678
"11124500","SANTA CRUZ C NR SANTA YNEZ CA",34.5966563,-119.9087519,0,5.35527777777778,0,0.055,2.05,4.7,13
"11138500","SISQUOC R NR SISQUOC CA",34.83970289,-120.1682063,0.2,11.0921428571429,0.932,1.5,2.3,7.4,19.5
"11139000","LA BREA C NR SISQUOC CA",34.852758,-120.1995967,NA,NA,NA,NA,NA,NA,NA
"11139500","TEPUSQUET C NR SISQUOC CA",34.87247964,-120.2445989,NA,NA,NA,NA,NA,NA,NA
"11141150","ARROYO GRANDE AB PHOENIX C NR ARROYO GRANDE CA",35.18858618,-120.4351621,NA,NA,NA,NA,NA,NA,NA
"11141280","LOPEZ C NR ARROYO GRANDE CA",35.23553035,-120.4723857,0.86,4.27472222222222,1.45,1.95,3.35,4.725,6.8
"11142500","ARROYO DE LA CRUZ NR SAN SIMEON CA",35.7171903,-121.2849258,NA,NA,NA,NA,NA,NA,NA
"11143000","BIG SUR R NR BIG SUR CA",36.24579648,-121.7732872,13,33.0777777777778,10.5,14,25,47.75,61
"11143500","SALINAS R NR POZO CA",35.29858465,-120.4037709,NA,NA,NA,NA,NA,NA,NA
"11148900","NACIMIENTO R BL SAPAQUE C NR BRYSON CA",35.78857918,-121.0938048,0,6.35277777777778,0,0.1375,1.12,9.05,17
"11151300","SAN LORENZO C BL BITTERWATER C NR KING CITY CA",36.26802087,-121.066303,0,2.03138888888889,0,0.0775,0.445,0.97,2.15
"11151870","ARROYO SECO NR GREENFIELD CA",36.23746164,-121.4816027,NA,NA,NA,NA,NA,NA,NA
"11152900","CEDAR C NR BELL STATION CA",37.0499451,-121.327431,NA,NA,NA,NA,NA,NA,NA
"11153470","LLAGAS C AB CHESBRO RES NR MORGAN HILL CA",37.14827978,-121.7682836,NA,NA,NA,NA,NA,NA,NA
"11153900","UVAS C AB UVAS RES NR MORGAN HILL CA",37.0927254,-121.7182818,NA,NA,NA,NA,NA,NA,NA
"11154100","BODFISH C NR GILROY CA",37.0041163,-121.6671686,NA,NA,NA,NA,NA,NA,NA
"11154700","CLEAR C NR IDRIA CA",36.36079387,-120.7607315,NA,NA,NA,NA,NA,NA,NA
"11160020","SAN LORENZO R NR BOULDER C CA",37.20661136,-122.1449644,NA,NA,NA,NA,NA,NA,NA
"11160300","ZAYANTE C A ZAYANTE CA",37.08605874,-122.0469069,NA,NA,NA,NA,NA,NA,NA
"11162500","PESCADERO C NR PESCADERO CA",37.26077707,-122.3288602,1.4,7.415,1.75,2.925,5.5,10,14.5
"11162570","SAN GREGORIO C A SAN GREGORIO CA",37.3257762,-122.3866404,NA,NA,NA,NA,NA,NA,NA
"11169800","COYOTE C NR GILROY CA",37.07772286,-121.4943832,NA,NA,NA,NA,NA,NA,NA
"11172945","ALAMEDA C AB DIV DAM NR SUNOL CA",37.4974356,-121.7735644,NA,NA,NA,NA,NA,NA,NA
"11173200","ARROYO HONDO NR SAN JOSE CA",37.46160337,-121.769397,NA,NA,NA,NA,NA,NA,NA
"11176400","ARROYO VALLE BL LANG CYN NR LIVERMORE CA",37.56132196,-121.6838389,0,1.87388888888889,0,0,0.09,2.075,5.4
"11180500","DRY C A UNION CITY CA",37.6060452,-122.0238504,0,0.103333333333333,0,0,0,0.015,0.295
"11180960","CULL C AB CULL C RES NR CASTRO VALLEY CA",37.71770737,-122.0544067,0,0.183888888888889,0,0.01,0.07,0.2825,0.485
"11182100","PINOLE C A PINOLE CA",37.97242309,-122.2463573,NA,NA,NA,NA,NA,NA,NA
"11195500","SAN EMIGDIO C A SAN EMIGDIO RANCHHOUSE CA",34.98163745,-119.1851097,NA,NA,NA,NA,NA,NA,NA
"11196400","CALIENTE C AB TEHACHAPI C NR CALIENTE CA",35.31134824,-118.5703669,NA,NA,NA,NA,NA,NA,NA
"11197250","AVENAL C NR AVENAL CA",35.85412696,-120.1270849,NA,NA,NA,NA,NA,NA,NA
"11199500","WHITE R NR DUCOR CA",35.80995236,-118.9184294,NA,NA,NA,NA,NA,NA,NA
"11203580","SF TULE R NR CHOLOLLO CAMPGROUND NR PORTERVILLE CA",36.04828125,-118.6542556,NA,NA,NA,NA,NA,NA,NA
"11204100","SF TULE R NR RESERVATION BNDRY NR PORTERVILLE CA",36.02411648,-118.8134258,NA,NA,NA,NA,NA,NA,NA
"11206800","MARBLE FORK KAWEAH R AB TOKOPAH FALLS NR KAWEAH CA",36.60855386,-118.6887086,NA,NA,NA,NA,NA,NA,NA
"11213500","KINGS R AB NF NR TRIMMER CA",36.8632806,-119.124282,NA,NA,NA,NA,NA,NA,NA
"11214000","NF KINGS R BL MEADOWBROOK CA",37.08133045,-118.862888,NA,NA,NA,NA,NA,NA,NA
"11220000","BIG C AB PINE FLAT RES NR TRIMMER CA",36.91633697,-119.2445652,NA,NA,NA,NA,NA,NA,NA
"11220500","SYCAMORE C AB PINE FLAT RES NR TRIMMER CA",36.9202264,-119.3098459,NA,NA,NA,NA,NA,NA,NA
"11224500","LOS GATOS C AB NUNEZ CYN NR COALINGA CA",36.21467719,-120.4707116,0,0.845277777777778,0,0,0,0.1375,1.625
"11226500","SAN JOAQUIN R A MILLER CROSSING CA",37.51049707,-119.1973476,NA,NA,NA,NA,NA,NA,NA
"11230500","BEAR C NR LAKE THOMAS A EDISON CA",37.3393863,-118.9734513,NA,NA,NA,NA,NA,NA,NA
"11237500","PITMAN C BL TAMARACK C CA",37.19855659,-119.2137328,NA,NA,NA,NA,NA,NA,NA
"11253310","CANTUA C NR CANTUA CREEK CA",36.40217399,-120.4334917,0,0.698611111111111,0,0,0,0.5675,2.1
"11257100","MIAMI C NR OAKHURST CA",37.39355278,-119.654318,NA,NA,NA,NA,NA,NA,NA
"11264500","MERCED R A HAPPY ISLES BRIDGE NR YOSEMITE CA",37.73131496,-119.5590514,99,1021.91666666667,153.5,257.5,598.5,1725,2505
"11266500","MERCED R A POHONO BRIDGE NR YOSEMITE CA",37.71687138,-119.6662788,109,1583.97222222222,201,338.5,868.5,2692.5,3935
"11269300","MAXWELL C A COULTERVILLE CA",37.71604127,-120.1899102,NA,NA,NA,NA,NA,NA,NA
"11274500","ORESTIMBA C NR NEWMAN CA",37.31549247,-121.1252081,0,0.223333333333333,0,0,0,0,0
"11274630","DEL PUERTO C NR PATTERSON CA",37.48659935,-121.2091026,0.02,0.922777777777778,0,0,0.03,0.7725,1.2
"11274790","TUOLUMNE R A GRAND CYN OF TUOLUMNE AB HETCH HETCHY",37.9165884,-119.6598938,NA,NA,NA,NA,NA,NA,NA
"11275000","FALLS C NR HETCH HETCHY CA",37.97075376,-119.7643429,NA,NA,NA,NA,NA,NA,NA
"11281000","SF TUOLUMNE R NR OAKLAND RECREATION CAMP CA",37.82159266,-120.0129616,NA,NA,NA,NA,NA,NA,NA
"11282000","M TUOLUMNE R A OAKLAND RECREATION CAMP CA",37.82825915,-120.0115727,NA,NA,NA,NA,NA,NA,NA
"11283500","CLAVEY R NR BUCK MEADOWS CA",37.90048017,-120.0718517,NA,NA,NA,NA,NA,NA,NA
"11284400","BIG C AB WHITES GULCH NR GROVELAND CA",37.8418714,-120.1849103,0,0.724722222222222,0,0,0.02,0.995,1.95
"11292500","CLARK FORK STANISLAUS R NR DARDANELLE CA",38.36380105,-119.8712915,NA,NA,NA,NA,NA,NA,NA
"11299600","BLACK C NR COPPEROPOLIS CA",37.96103615,-120.6152035,0,0.175,0,0,0,0.1475,0.383
"11315000","COLE C NR SALT SPRINGS DAM CA",38.5190783,-120.2126928,NA,NA,NA,NA,NA,NA,NA
"11334300","SF COSUMNES R NR RIVER PINES CA",38.5568511,-120.7932682,NA,NA,NA,NA,NA,NA,NA
"11337500","MARSH C NR BYRON CA",37.87325835,-121.7271752,NA,NA,NA,NA,NA,NA,NA
"11355500","HAT C NR HAT CREEK CA",40.68654984,-121.4246992,NA,NA,NA,NA,NA,NA,NA
"11364300","HATCHET C BL DIV TO HATCHET C PP NR MNTGMRY C CA",40.87737886,-121.8663833,NA,NA,NA,NA,NA,NA,NA
"11371000","CLEAR C A FRENCH GULCH CA",40.6948699,-122.6366845,NA,NA,NA,NA,NA,NA,NA
"11379000","ANTELOPE C NR RED BLUFF CA",40.2037674,-122.1183272,NA,NA,NA,NA,NA,NA,NA
"11381500","MILL C NR LOS MOLINOS CA",40.0546022,-122.0241541,89,275.305555555556,118,135.5,197,364.25,543
"11383500","DEER C NR VINA CA",40.01404745,-121.9483181,69,158.75,89,92.5,124,180.25,291
"11384000","BIG CHICO C NR CHICO CA",39.7762726,-121.753866,NA,NA,NA,NA,NA,NA,NA
"11390672","STONE CORRAL C NR SITES CA",39.2882206,-122.3010909,NA,NA,NA,NA,NA,NA,NA
"11409300","OREGON C A CAMPTONVILLE CA",39.4460031,-121.046343,NA,NA,NA,NA,NA,NA,NA
"11409500","OREGON C NR NORTH SAN JUAN CA",39.4026698,-121.0774542,NA,NA,NA,NA,NA,NA,NA
"11413320","DEADWOOD C NR STRAWBERRY VALLEY CA",39.54989055,-121.0944014,NA,NA,NA,NA,NA,NA,NA
"11413323","OWL GULCH NR STRAWBERRY VALLEY CA",39.5454461,-121.0952348,NA,NA,NA,NA,NA,NA,NA
"11426150","ONION C NR SODA SPRINGS CA",39.26712708,-120.3649233,NA,NA,NA,NA,NA,NA,NA
"11427700","DUNCAN CYN C NR FRENCH MEADOWS CA",39.1357376,-120.4785353,NA,NA,NA,NA,NA,NA,NA
"11431800","PILOT C AB STUMPY MEADOWS RES CA",38.8946257,-120.5682585,NA,NA,NA,NA,NA,NA,NA
"11433260","NF OF MF AMERICAN R NR FORESTHILL CA",39.0240671,-120.7185401,NA,NA,NA,NA,NA,NA,NA
"11449500","KELSEY C NR KELSEYVILLE CA",38.92739984,-122.8436046,0.27,9.33342857142857,1.94,3.15,6.4,14.5,21.6
"11451100","NF CACHE C A HOUGH SPRING NR CLEARLAKE OAKS CA",39.1654458,-122.6199862,0.66,10.8933333333333,2.1,2.7,6.8,14.25,25.5
"11464500","DRY C NR CLOVERDALE CA",38.74963216,-123.0922252,NA,NA,NA,NA,NA,NA,NA
"11467200","AUSTIN C NR CAZADERO CA",38.5065797,-123.0697239,NA,NA,NA,NA,NA,NA,NA
"11467500","SF GUALALA R NR ANNAPOLIS CA",38.70491205,-123.4230642,NA,NA,NA,NA,NA,NA,NA
"11467600","GARCIA R NR POINT ARENA CA",38.92629636,-123.6302925,NA,NA,NA,NA,NA,NA,NA
"11468000","NAVARRO R NR NAVARRO CA",39.17045608,-123.668069,2.5,36.6194444444444,10.5,12,23.5,53.75,69.5
"11468500","NOYO R NR FORT BRAGG CA",39.42822378,-123.7377917,4.5,25.9222222222222,9.8,12,20,31.5,45.5
"11468900","MATTOLE R NR ETTERSBURG CA",40.139309,-123.991423,NA,NA,NA,NA,NA,NA,NA
"11472160","WILLITS C AB LK EMILY NR WILLITS CA",39.449329,-123.3980667,NA,NA,NA,NA,NA,NA,NA
"11472900","BLACK BUTTE R NR COVELO CA",39.82071008,-123.0816755,NA,NA,NA,NA,NA,NA,NA
"11473900","MF EEL R NR DOS RIOS CA",39.70626687,-123.3252913,22,250,45.5,69.5,104.5,261.25,779
"11474500","NF EEL R NR MINA CA",39.9373742,-123.3469626,NA,NA,NA,NA,NA,NA,NA
"11475500","SF EEL R NR BRANSCOMB CA",39.71904456,-123.652796,NA,NA,NA,NA,NA,NA,NA
"11475560","ELDER C NR BRANSCOMB CA",39.7295997,-123.6439073,1,4.5,1.9,2.45,3.3,5.4,8.2
"11475800","SF EEL R A LEGGETT CA",39.8745957,-123.7205775,27,88.8275862068966,35.6,50,75,110,149.4
"11476600","BULL C NR WEOTT CA",40.351528,-124.0050423,3.1,15.1916666666667,5.4,6.75,9.4,14.5,21
"11478500","VAN DUZEN R NR BRIDGEVILLE CA",40.48041636,-123.890876,19,92.25,30.5,40.75,58.5,101.5,198
"11480390","MAD R AB RUTH RES NR FOREST GLEN CA",40.28431329,-123.3353034,2.9,20.9,3.95,5.8,12,27.5,50
"11481200","LITTLE R NR TRINIDAD CA",41.0098479,-124.0814555,8.1,25.45,11.5,14,18,27.75,51.5
"11481500","REDWOOD C NR BLUE LAKE CA",40.90596479,-123.815335,11,42.46875,18,22,30.5,53.5,73.9
"11482500","REDWOOD C A ORICK CA",41.2992896,-124.0511825,41,177.555555555556,68,94.75,136,195.25,332
"11489500","ANTELOPE C NR TENNANT CA",41.5465435,-121.9183368,NA,NA,NA,NA,NA,NA,NA
"11516900","LITTLE SHASTA R NR MONTAGUE CA",41.75292395,-122.3005717,NA,NA,NA,NA,NA,NA,NA
"11522500","SALMON R A SOMES BAR CA",41.3765154,-123.4770026,351,1267.77777777778,357,610.75,1020,1645,2810
"11523200","TRINITY R AB COFFEE C NR TRINITY CENTER CA",41.1112571,-122.7055788,45,360.5,75.5,94.75,159,381.25,1094.5
"11525530","RUSH C NR LEWISTON CA",40.7245899,-122.8347458,NA,NA,NA,NA,NA,NA,NA
"11525670","INDIAN C NR DOUGLAS CITY CA",40.65181225,-122.9144689,NA,NA,NA,NA,NA,NA,NA
"11526500","NF TRINITY R A HELENA CA",40.7818089,-123.1283653,NA,NA,NA,NA,NA,NA,NA
"11528700","SF TRINITY R BL HYAMPOM CA",40.6498627,-123.4942046,72,332.277777777778,123,166.5,243,450.75,677
"11532500","SMITH R NR CRESCENT CITY CA",41.7915026,-124.0761887,417,890.777777777778,496,648.25,729.5,1037.5,1440
